id;platform;category;caption;hashtag;url;text_for_tfidf;like;views;comments;engagement_rate;is_popular;shares;saves
100;Tiktok;Belajar IT;"""Belajar jadi hacker nggak harus jago duluan, yang penting mulai dulu. #belajarIT #hackerpemula #cybersecurity #motivasiIT #tiktokbelajar """;belajarit,hackerpemula,cybersecurity,motivasiit,tiktokbelajar;https://www.tiktok.com/@fidztech7/video/7527595924235832583;ajar hacker jago ulua ulu ajar hacker emu cyber security motivasi tik tok ajar ajar hacker emu cyber security motivasi tik tok ajar;3585;71400;252;6.94;0;159;956
101;Tiktok;Belajar IT;IT Student #codingtiktok #softwaredevelopment #developerlife #itstudent;codingtiktok,softwaredevelopment,developerlife,itstudent;https://www.tiktok.com/@pixeldevp/video/7587817048630119736;student coding tik tok software development developer life its dent coding tik tok software development developer life its dent;3268;28200;20;13.73;1;126;459
102;Tiktok;Belajar IT;When I started learning how to code I had to put in countless hours a day to learn new concepts. I even worked at an internship that paid $2 an hour to help better myself in this profession and it eventually paid off and now i’m making over 10k/month. If you want to do the same follow me and I’ll help you in your journey #programming #computerscience #softwareengineer #tech #learntocode #coding;programming,computerscience,softwareengineer,tech,learntocode,coding;https://www.tiktok.com/@davidabragg/video/7273748826085805314;when start learning how code had put countless hour day learn new concept even worked internship that pai hour help better myself this profession and eventually pai off and now making over month you want the same follow and help you your journey programming computer science software engineer tech learnt code coding programming computer science software engineer tech learnt code coding;5154;101800;82;7.05;0;96;1841
103;Tiktok;Belajar IT;"Zaman sekarang belajar IT gak harus nunggu kuliah!
Cukup HP & niat, anak-anak pun bisa mulai dari sekarang.
Cocok buat SD, SMP, sampai SMA! ‍‍
Bisa jadi bekal masa depan 

#BelajarIT #AnakCerdasDigital #CodingUntukAnak #NgodingDiHP #AplikasiEdukasi #ParentingDigital #AnakZamanNow #BelajarITDariHP #TeknologiPendidikan";;https://www.tiktok.com/@happycoderid/video/7510802927829683463;zaman ajar nung kuliah niat anak anak cocok sma bekal ajar anak cerdas digital coding anak coding aplikasi edukasi parent ing digital anak zaman now ajar teknologi pend ikan;58;12900;1;0.67;0;6;22
104;Tiktok;Belajar IT;we’re not leaving the beginner computer science girlies behind  @Codédex #computersciencegirlies #computersciencemajor #ibcomputerscience #apcomputerscience;computersciencegirlies,computersciencemajor,ibcomputerscience,apcomputerscience;https://www.tiktok.com/@michellescomputer/video/7256972702894820651;not leaving the beginner computer science girlie behind cod computer science girlie computer science major computer science computer science computer science girlie computer science major computer science computer science;137500;1200000;548;20.4;1;9405;97339
105;Tiktok;Belajar IT;Web developers  #fyp #foryou #bsit #it #coding #programming #webdevelopment #techtok;fyp,foryou,bsit,it,coding,programming,webdevelopment,techtok;https://www.tiktok.com/@wreckzonee/video/7387379523681144080;web developer for you sit coding programming web development tech tok for you sit coding programming web development tech tok;7992;106300;51;11.65;1;200;4141
106;Tiktok;Belajar IT;Belajar IT emg seru kok #ngoding #IT #programming;ngoding,it,programming;https://www.tiktok.com/@umam_syarief/video/7582826057422753045;ajar seru coding programming coding programming;16;415;0;4.34;0;0;2
107;Tiktok;Belajar IT;"Nah, kalau kamu bisa belajar coding juga, kamu mau buat apa dulu nih? Game, Website, atau robot? 

#YukIT #Mataram #BelajarIT #CodingAnak #FYPIndonesia";YukIT,Mataram,BelajarIT,CodingAnak,FYPIndonesia;https://www.tiktok.com/@yuk_it/video/7566280786937122069;ajar coding ulu nih game web site robot yuk matara ajar coding pind one sia yuk matara ajar coding pind one sia;12;751;0;1.86;0;0;2
108;Tiktok;Belajar IT;If you want to study IT and work in an office-based IT role, you should learn CompTIA A+, Network+, Windows Server, Microsoft Office/Office 365, ticketing systems, Active Directory, and tools like Jira. These skills are commonly required for entry-level IT support and help desk jobs.#abgaaley #fyp #fypagee #motivition #inspirationalquotes;abgaaley,fyp,fypagee,motivition,inspirationalquotes;https://www.tiktok.com/@flavor_queeen/video/7584781328907029763;you want study and work office based role you should learn network windows server micro soft office office ticketing system active directory and tool like jir these skill are commonly require for entry level support and help desk job ale page mot ion inspirational quote ale page mot ion inspirational quote;1608;15400;36;13.58;1;147;301
109;Tiktok;Belajar IT;"Hi IT Enthusiast!
Kalian mau belajar Networking tapi bingung karena gak punya alatnya ? coba tonton video ini, dan jangan lupa di share dan follow ya
Belajar sama sama, sama sama belajar
#belajarit #belajarnetworking #belajarserver #itpemula #cisco";belajarit,belajarnetworking,belajarserver,itpemula,cisco;https://www.tiktok.com/@dokter.it/video/7455586090523626759;enthusiast ajar network ing bingung alat coba tonton video lupa share follow ajar ajar ajar ajar network ing ajar server emu cisco ajar ajar network ing ajar server emu cisco;7;471;0;2.76;0;1;5
110;Tiktok;Belajar IT;"Check out these Top 10 Best Tech Jobs by Investopedia

Looking for an IT related Certification? Check out www.trainingcreatively.com to learn more.

#techjobs #informationtechnology #itjobsforyou #ITjobs #careergoals #careeradvice #careertips #careerdevelopment #certification #getcertified #upskill #datascientist #datascience #softwaredeveloper #informationsecurityanalyst #computersystemanalyst #webdeveloper #salesengineers #ITmanager #computerscientist #networkadministrator #systemadministrator #computersupportspecialist #fyp #fypuk #foryoupage";techjobs,informationtechnology,itjobsforyou,itjobs,careergoals,careeradvice,careertips,careerdevelopment,certification,getcertified,upskill,datascientist,datascience,softwaredeveloper,informationsecurityanalyst,computersystemanalyst,webdeveloper,salesengineers,itmanager,computerscientist,networkadministrator,systemadministrator,computersupportspecialist,fyp,fypuk,foryoupage;https://www.tiktok.com/@training.creatively/video/7217845084287421701;check out these top best tech job invest ope looking for related certification check out training creatively learn more tech job information technology job for you job career goal career advice career tips career development certification get certified skill data scientist data science software developer information security analyst computer system analyst web developer sale seng eer manager computer scientist network administrator system administrator computer support specialist for youp age tech job information technology job for you job career goal career advice career tips career development certification get certified skill data scientist data science software developer information security analyst computer system analyst web developer sale seng eer manager computer scientist network administrator system administrator computer support specialist for youp age;3110;122500;46;3.45;0;285;786
111;Tiktok;Belajar IT;"Bukan buat jahat, tapi buat ngerti sistem, deteksi celah, dan jadi garda pertama keamanan digital.
Buku hacking ini cocok buat kamu yang penasaran dunia IT, pengen jadi ethical hacker, atau sekadar ngerti cara kerja dunia siber.

#BukuHacking #EthicalHacker #BelajarIT #CyberSecurity #HackForGood #NgodingPemula #bukaulasan";bukuhacking,ethicalhacker,belajarit,cybersecurity,hackforgood,ngodingpemula,bukaulasan;https://www.tiktok.com/@bukaulasan.id/video/7529411497512947000;jahat paham sistem deteksi celah garda kea digital buku hacking cocok penasaran dunia pen gen ethical hacker paham kerja dunia sib buku hacking ethical hacker ajar cyber security hack forgo coding emu bukau lasa buku hacking ethical hacker ajar cyber security hack forgo coding emu bukau lasa;20;1647;1;2.19;0;2;13
112;Tiktok;Belajar IT;"Girls who code write the future ‍
#informationtechnology #itgirl";informationtechnology,itgirl;https://www.tiktok.com/@casa.reyna_/video/7558541705952251143;girl who code write the future information technology girl information technology girl;55000;375000;113;17.15;1;2328;6866
113;Tiktok;Belajar IT;Tips for Incoming IT student #fyp #programming #bsit #freshmen #college #incomingfreshman;fyp,programming,bsit,freshmen,college,incomingfreshman;https://www.tiktok.com/@jbvillegas935/video/7524307011446639890;tips for incoming student programming sit fresh men college incoming freshman programming sit fresh men college incoming freshman;22700;262500;247;13.13;1;1284;10242
114;Tiktok;Belajar IT;Replying to @user5096349177822 #kojond #fyp #uni #it #informationtechnology;kojond,fyp,uni,it,informationtechnology;https://www.tiktok.com/@kojond/video/7186791834079792390;reply ing user uni information technology uni information technology;5358;272100;86;2.43;0;357;818
115;Tiktok;Belajar IT;"haah senang.. senang jadi gila 
#CapCut #fyp #onthisday #fypage";capcut,fyp,onthisday,fypage;https://www.tiktok.com/@lieyenrhmn/video/7533814354739760402;senang senang gila cap cut this day page cap cut this day page;32600;286200;308;13.95;1;4770;2256
116;Tiktok;Belajar IT;"⋆౨ৎ˚⟡˖ ࣪  Follow me on ig : @girlsdecodethings

#coding #stem #womeninstem #fyp #";coding,stem,womeninstem,fyp;https://www.tiktok.com/@girls.decode.things/video/7549140041390427399;follow girl decode thing coding stem meni stem coding stem meni stem;14800;113200;406;18.26;1;1363;4104
117;Tiktok;Belajar IT;"Sukses ANBK
#belajarit 
#tetapsoliddankompak 
#semangat";belajarit,tetapsoliddankompak,semangat;https://www.tiktok.com/@fitria.kusuma.war/video/7407374664604896517;sukses ajar solid dank semangat ajar solid dank semangat;135;27200;4;0.61;0;6;20
118;Tiktok;Belajar IT;bole senang gile;;https://www.tiktok.com/@y2krizx4/video/7569878702109003028;bole senang;23500;232400;284;11.26;0;1537;844
119;Tiktok;Belajar IT;"to the man that taught me how to code from day 1 !

During my undergraduate degree in Physics with Medical Physics and Bioengineering I had a coding in MATLAB module that I didn’t understand at all  I actually used to really dislike coding - simply cause i had no idea what was going on!! 

Thanks to this man’s YouTube channel I genuinely got a 1:1 in my coding module 

.. I remember one time I was translating from Hindi to English to try complete an assignment ☠️

Fast forward to years later I thought myself to code in:

R
MATLAB
& I’m currently learning Python (gonna be the main language I use with my new job in tech)

☁️ did this channel save any1 else?

#codingtok #codinglife #coding #programming #codingtiktok";codingtok,codinglife,coding,programming,codingtiktok;https://www.tiktok.com/@thephdstudent/video/7253124789403929882;the man that taught how code from day during undergraduate degree physics with medical physics and engineering had coding mat lab module that did understand all actually used really dislike coding simply cause had idea what was going thanks this man you tube channel genuinely got coding module remember one time was trans lating from hindi lish try complete assignment fast forward year later thought myself code mat lab currently learning python gon the main language use with new job tech did this channel save any else coding tok coding life coding programming coding tik tok coding tok coding life coding programming coding tik tok;862600;5800000;1521;18.69;1;19300;200417
120;Tiktok;Belajar IT;5 free homelab projects to ramp up your IT Skills. They’re hard if you’re new, but you should do them! #homelab #joecoxtech #techtips #learn #networkengineer;homelab,joecoxtech,techtips,learn,networkengineer;https://www.tiktok.com/@joecoxtech/video/7564478201620221197;free home lab project ramp your skill they hard you new but you should them home lab joe cox tech tech tips learn network engineer home lab joe cox tech tech tips learn network engineer;43000;488800;348;15.99;1;3106;31717
121;Tiktok;Belajar IT;"App for coding
#programing #computerscience #IT #coding #InspiredAwesomeLife #foryou #fyp #fyp #new #goviral";programing,computerscience,it,coding,inspiredawesomelife,foryou,fyp,fyp,new,goviral;https://www.tiktok.com/@mr.coder05/video/7229528631683403014;for coding program ing computer science coding inspired awesome life for you new viral program ing computer science coding inspired awesome life for you new viral;227800;3100000;832;10.84;0;8144;99333
122;Tiktok;Belajar IT;How To Get Good At Programming #programming #coding #code #tech;programming,coding,code,tech;https://www.tiktok.com/@meech.s.ward/video/7323651077352525062;how get good programming programming coding code tech programming coding code tech;13600;232300;142;8.17;0;540;4694
123;Tiktok;Belajar IT;How to start learning coding for beginners;;https://www.tiktok.com/@zararzln/video/7575467702161116437;how start learning coding for beginner;10500;138300;69;11.44;1;700;4556
124;Tiktok;Belajar IT;"Belajar IT itu nggak sesulit yang kalian bayangkan! Yang penting jangan gampang nyerah.

#AnakIT #falsebelief";anakit,falsebelief;https://www.tiktok.com/@fransiskus.alvin/video/7487914643785125127;ajar sulit bayang mudah nye rah anakit false belief anakit false belief;23;462;0;6.06;0;1;4
125;Tiktok;Belajar IT;day4 belajar#gfx #bismillahfyp #belajar #gfx #fyppp;gfx,bismillahfyp,belajar,gfx,fyppp;https://www.tiktok.com/@pemula.gfx20/video/7514877485973064966;day ajar bismillah ajar bismillah ajar;135800;1100000;893;13.91;1;6145;10128
126;Tiktok;Belajar IT;"Translate into english lagi
•
Kamu cari kursus Bahasa Inggris di Bandung? Mau isi waktu untuk les di Kampung Inggris? Yuk join Kampung Inggris Bandung EPLC 

Daftarkan dirimu sekarang!
•
#Kampunginggris #kampunginggrisbandungeplc  #kampunginggrisbdg #EPLC #belajaringgris #kursusinggris #toefl #vocabulary #learnenglish #kursusinggrisbandung #lesbahasainggrisdibandung";kampunginggris,kampunginggrisbandungeplc,kampunginggrisbdg,eplc,belajaringgris,kursusinggris,toefl,vocabulary,learnenglish,kursusinggrisbandung,lesbahasainggrisdibandung;https://www.tiktok.com/@kampunginggrisbdg/video/7431893738122661121;translate into lish cari kursus bahasa inggris bandung isi les kampung inggris yuk join kampung inggris bandung daftar kampung inggris kampung inggris bandung kampung inggris ajar inggris kursus inggris toe vocabulary learn lish kursus inggris bandung les bahasa inggris dib and kampung inggris kampung inggris bandung kampung inggris ajar inggris kursus inggris toe vocabulary learn lish kursus inggris bandung les bahasa inggris dib and;56200;1700000;421;3.64;0;1147;4146
127;Tiktok;Belajar IT;"Best experience ❤️
#pare #kampunginggrispare #englishcourse #kampunginggris #kursusbahasainggris";pare,kampunginggrispare,englishcourse,kampunginggris,kursusbahasainggris;https://www.tiktok.com/@lailaffwhoo/video/7556169490220846348;best experience pare kampung inggris pare lish course kampung inggris kursus bahasa inggris pare kampung inggris pare lish course kampung inggris kursus bahasa inggris;19000;196800;450;11.06;0;752;1558
128;Tiktok;Belajar IT;Mulai aja dulu ga sie #remotework #belajarbahasainggris #learnenglish #selfimprovement #englislearner;remotework,belajarbahasainggris,learnenglish,selfimprovement,englislearner;https://www.tiktok.com/@fifi.does.english/video/7582268075710500103;aja ulu sie remote work ajar bahasa inggris learn lish self improvement lisle arn remote work ajar bahasa inggris learn lish self improvement lisle arn;5419;54800;191;16.24;1;1034;2253
129;Tiktok;Belajar IT;Yuk langsung belajar via @Gamelab Indonesia buat dapetin info belajar IT yang jelas dan sesuai standar industri saat ini.;;https://www.tiktok.com/@lukananakit/video/7124961957442080027;yuk langsung ajar via game lab indonesia dap tin info ajar sesuai standar industri;666;10800;9;9.29;0;8;320
130;Tiktok;Belajar IT;Nama website di akhir video ya! #belajarcoding #progamer #belajarit #belajardarirumah #coding #fyp;belajarcoding,progamer,belajarit,belajardarirumah,coding,fyp;https://www.tiktok.com/@course_net/video/6991379464341015810;nama web site video belajarcoding prog ame ajar ajar rumah coding belajarcoding prog ame ajar ajar rumah coding;839;8943;5;12.49;1;37;236
131;Tiktok;Belajar IT;"Pendaftaran Santri Baru Pondok IT ‍

Untuk kamu yang mau belajar skill IT sekaligus belajar agama, GRATIS, dengan lingkungan yang Islami.

Selamat kamu menemukan tempat yang tepat! 
Pondok IT Indonesia jadi solusinya. 

Untuk pendaftaran santri baru bisa langsung klik link berikut
www.pondokit.com

Kalau kamu penasaran dan ingin tau tentang info Pondok IT lebih lengkap,
silakan hubungi  wa.me/6289528002800

Tunggu apa lagi? Yuk segera daftar! Kuota terbatas ‼️

#pendidikangratis #belajarquran #belajarit #pondok #pondokit #jagoquranjagoit #lingkunganpositif";pendidikangratis,belajarquran,belajarit,pondok,pondokit,jagoquranjagoit,lingkunganpositif;https://www.tiktok.com/@pondokitofficial/video/7508310328782916869;penda tara santri pondok ajar skill ajar agama gratis lingkung islami selamat men emu pondok indonesia solusi penda tara santri langsung klik link berik pondok penasaran info pondok lengkap sila hubung tunggu yuk daftar kuota ter batas pend ikan gratis ajar quran ajar pondok pondok jago quran jago lingkung positif pend ikan gratis ajar quran ajar pondok pondok jago quran jago lingkung positif;34500;1100000;2009;4.87;0;9350;7760
132;Tiktok;Belajar IT;"Halo Haltevers! masih bingung mulai belajar IT dari mana?
Santai semua orang juga pernah mulai dari nol 

Roadmap ini bisa kamu ikuti buat masuk dunia IT dari basic sampai siap kerja:

 Mulai dari dasar komputer & internet
 Latih pola pikir problem-solving
 Pelajari bahasa pemrograman untuk pemula seperti Python dan Java Script
 Tentukan jalur karier: Web, Data, Cyber, AI dan masih banyak jalur lainnya
 Bangun project & portofolio nyata

Belajar IT bukan soal cepat-cepat jago tapi punya pondasi yang kuat dengan belajar step-by-step ✨

Mau belajar dengan panduan terarah, kelas interaktif, dan dukungan mentor profesional? Yuk Belajar bareng Haltev, kamu akan dibimbing mulai dari nol sampai siap kerja 

Ingin daftar kelas? klik link yang ada di bio yaa 

#haltev #opportunityinyourhand #RoadmapBelajarIT #DigitalSkills #BelajarCoding";haltev,opportunityinyourhand,roadmapbelajarit,digitalskills,belajarcoding;https://www.tiktok.com/@haltevid/video/7569950981715234066;halo halte ers bingung ajar santai orang nol road map masuk dunia basic kerja dasar komputer intern latih pola pikir problem sol ing pel ajar bahasa rog rama emu python java script jalur karier web data cyber jalur bangun project portofolio nyata ajar cepat cepat jago pond asi kuat ajar step step ajar pandu tera rah kelas interaktif dukung mentor profesional yuk ajar bareng halte dib bing nol kerja daftar kelas klik link halte opportunity your hand road map ajar digital skill belajarcoding halte opportunity your hand road map ajar digital skill belajarcoding;824;11200;0;7.45;0;0;10
133;Tiktok;Belajar IT;"Replying to @Newbie.tech.id Gue udah siapin roadmap dan course nya GRATIS, tinggal cek link di bio gua 

#programmer #web3 #blockchain #belajarngoding #softwaredeveloper #anakit #anaksmk #edukasi";programmer,web3,blockchain,belajarngoding,softwaredeveloper,anakit,anaksmk,edukasi;https://www.tiktok.com/@zexoverz/video/7459593771265641745;reply ing new tech road map course gratis tinggal cek link gua programmer web block chain ajar coding software developer anakit anak edukasi programmer web block chain ajar coding software developer anakit anak edukasi;2441;33600;58;12.34;1;173;1474
134;Tiktok;Belajar IT;Minflo paling suka web yg terakhir sih  #belajarkoding #lukananakit #anakit;belajarkoding,lukananakit,anakit;https://www.tiktok.com/@lukananakit/video/6929099832187424002;min suka web terak sih ajar kodi luka nana kit anakit ajar kodi luka nana kit anakit;2005;19300;13;14.58;1;64;732
135;Tiktok;Belajar IT;"2 Cara buat lu mulai belajar IT

#codingtips #programmingtips #programmingindonesia #tipscoding #mabait";codingtips,programmingtips,programmingindonesia,tipscoding,mabait;https://www.tiktok.com/@edbertjuka/video/7542908378838748423;ajar coding tips programming tips programming indonesia tips coding bait coding tips programming tips programming indonesia tips coding bait;369;5228;3;11.38;1;50;173
136;Tiktok;Belajar IT;"Buat kamu yang mau belajar IT tapi blm tau dari manaa? Tonton vidio ini yaaa!! 

#i #IT #fyp #fyp #fypシ #fypシ #fypシ゚viral #fypage #fypdongggggggg #fyppppppppppppppppppppppp #fypp #fypdong #fypgakni #fypsounds #viral #viralvideo #viraltiktok #virall #viral_video #viralvideos #viralditiktok #viraliza #virale #viralllllll #fypcuyyyyyyyyyyyyyyyy #fypcukkkkkkk #internet #internacional #international";i,it,fyp,fyp,fypシ,fypシ,fypシ゚viral,fypage,fypdongggggggg,fyppppppppppppppppppppppp,fypp,fypdong,fypgakni,fypsounds,viral,viralvideo,viraltiktok,virall,viral_video,viralvideos,viralditiktok,viraliza,virale,viralllllll,fypcuyyyyyyyyyyyyyyyy,fypcukkkkkkk,internet,internacional,international;https://www.tiktok.com/@trainocate.id/video/7237472978030628102;ajar tonton viral page sound viral viral video viral tik tok viral viral video viral video viral dit tok viral viral viral cuk intern intern aci ona international viral page sound viral viral video viral tik tok viral viral video viral video viral dit tok viral viral viral cuk intern intern aci ona international;58;2752;7;3.49;0;24;7
137;Tiktok;Belajar IT;"Cocok Untuk Pemula Yang Ingin Belajar Merakit PC Secara Virtual | Cisco IT Essential Dekstop 

#cisconetworking #ciscosystems #jaringankomputer #rakitpc #tkj #smkbisa #4u #lewatberanda #fyppppppppppppppppppppppp";cisconetworking,ciscosystems,jaringankomputer,rakitpc,tkj,smkbisa,4u,lewatberanda,fyppppppppppppppppppppppp;https://www.tiktok.com/@mas.ozann/video/7545472242126163208;cocok emu ajar merak sec ara virtual cisco essential dek stop cisco network ing cisco system jaring komputer rakit beranda cisco network ing cisco system jaring komputer rakit beranda;506;14200;24;5.65;0;63;210
138;Tiktok;Belajar IT;"Belajar Laravel makin gampang!
Source code Laravel Cocok buat kamu yang lagi belajar Laravel 
Pas banget untuk mahasiswa IT & web developer 

 Cek link di bio sekarang!

#laravel #sourcecode #belajarngoding #mahasiswaIT #webdeveloper";laravel,sourcecode,belajarngoding,mahasiswait,webdeveloper;https://www.tiktok.com/@techgeekuniverseid/video/7555423180270210311;ajar laravel mudah source code laravel cocok ajar laravel pas banget mahasiswa web developer cek link laravel source code ajar coding mahasiswait web developer laravel source code ajar coding mahasiswait web developer;101;2821;4;4.93;0;6;28
139;Tiktok;Belajar IT;Susah2 belajar it nanti jdi apa ya? #fyp #it t#programmer #gajiprogrammer #spillgaji #developer #mahasiswa;fyp,it,programmer,gajiprogrammer,spillgaji,developer,mahasiswa;https://www.tiktok.com/@dibimbing.id/video/7175880422650285339;susah ajar programmer gaji programmer spill gaji developer mahasiswa programmer gaji programmer spill gaji developer mahasiswa;77;3439;0;3.14;0;17;14
140;Tiktok;Belajar IT;"8 tahun jadi IT Business Analyst bikin gue sadar satu hal, project sukses selalu dimulai dari requirement gathering yang solid.
Di video ini gue jelasin dengan bahasa sederhana biar kalian yang baru mulai karier di dunia BA bisa langsung paham dan praktik. 

#ITBusinessAnalyst #RequirementGathering #BusinessAnalysis #BAIndonesia #BelajarIT";itbusinessanalyst,requirementgathering,businessanalysis,baindonesia,belajarit;https://www.tiktok.com/@irvanrobs/video/7559065727521541388;business analyst sadar project sukses dim ula requirement gathering solid video bahasa sederhana biar karier dunia langsung paham praktik business analyst requirement gathering business analysis bain done sia ajar business analyst requirement gathering business analysis bain done sia ajar;62;1311;11;7.48;0;2;23
141;Tiktok;Belajar IT;"Jangan buang waktu belajar coding sendiri, mending ikut kelas Website Developer Phincon Academy dan siap-siap jadi developer profesional!

#BelajarIT #coding #ITBootcamp #PhinconAcademy";belajarit,coding,itbootcamp,phinconacademy;https://www.tiktok.com/@phinconacademy/video/7502384922557041938;buang ajar coding mending kelas web site developer phi con academy developer profesional ajar coding bootcamp phi con academy ajar coding bootcamp phi con academy;43;1028;0;5.64;0;4;11
142;Tiktok;Belajar IT;Reply to @user067545638 Website belajar IT! #belajarcoding #coding #softwareengineer #jagoit;belajarcoding,coding,softwareengineer,jagoit;https://www.tiktok.com/@beautifulcode_/video/7042699888315927834;reply user web site ajar belajarcoding coding software engineer jago belajarcoding coding software engineer jago;568;5600;9;13.93;1;16;187
143;Tiktok;Belajar IT;"Halo guys. Ini akun untuk belajar IT untuk para pemula. Bagi yang masih SMA, baru masuk kuliah ataupun career switcher, mau belajar IT? Follow aja akun ini

#fyp #viral #it #belajarit #belajarprogramming #kerjait #kerjaitjepang #kerjadijepang #kerjakejepang";fyp,viral,it,belajarit,belajarprogramming,kerjait,kerjaitjepang,kerjadijepang,kerjakejepang;https://www.tiktok.com/@pemula.it/video/7415046069496597768;halo guy akun ajar emu sma masuk kuliah career switcher ajar follow aja akun viral ajar ajar programming kerja kerja jepa kerja jepa kerja jepa viral ajar ajar programming kerja kerja jepa kerja jepa kerja jepa;5;103;4;8.74;0;0;0
